<?xml version='1.0' encoding='UTF-8' standalone='no'?>

<!DOCTYPE xmlmanual SYSTEM "wimp.dtd">

<!-- Copyright 2015-2026, Stephen Fryatt (info@stevefryatt.org.uk)
   -
   - This file is part of Wimp Programming In C:
   -
   -   http://www.stevefryatt.org.uk/risc-os/wimp-prog
   -
   - Licensed under the EUPL, Version 1.2 only (the "Licence");
   - You may not use this work except in compliance with the
   - Licence.
   -
   - You may obtain a copy of the Licence at:
   -
   -   http://joinup.ec.europa.eu/software/page/eupl
   -
   - Unless required by applicable law or agreed to in
   - writing, software distributed under the Licence is
   - distributed on an "AS IS" basis, WITHOUT WARRANTIES
   - OR CONDITIONS OF ANY KIND, either express or implied.
   -
   - See the Licence for the specific language governing
   - permissions and limitations under the Licence.
  -->

<manual xmlns:xsi="http://www.w3.org/2001/XMLSchema-instance" xsi:noNamespaceSchemaLocation="xmldoc.xsd" version="1.8.6">
<title>Wimp Programming In C</title>
<breadcrumb><dir>Home</dir><dir>RISC&nbsp;OS</dir></breadcrumb>
<icons>
<zip width="34" height="34">../../images/types/zip.png</zip>
<armv7 alt="ARMV7 OK" width="34" height="39">../../images/compatibility/armv7.png</armv7>
<iyonix alt="Iyonix OK" width="34" height="39">../../images/compatibility/iyonix.gif</iyonix>
</icons>
<resources>
<images>Images</images>
<downloads>Downloads</downloads>
<common>Common</common>
<chapters>Chapters</chapters>
</resources>
<licence>Version 1.2 of the European Union Public Licence</licence>

<!-- Index -->

<index>
<filename>index.php</filename>
<uri>./</uri>
<uri></uri>
<section>
<p>Like many other RISC&nbsp;OS users, I started programming in BBC&nbsp;BASIC. Although it served me well, I began to find that it didn&rsquo;t always scale well &ndash; especially when software had to handle large, variable amounts of data or multiple documents.</p>

<p>After learning C on Unix systems, I began to investigate how it could be used on RISC&nbsp;OS. My first efforts directly copied the techniques used in BASIC, and quickly became just as unweildy as their predecessors.</p>

<p>Eventually I settled on using a combination of <link href="http://ro-oslib.sourceforge.net/">OSLib</link> and my own libraries &ndash; imaginatively called SFLib &ndash; based on it. Together, these have formed the basis of all of my software which has been started since 2000.</p>

<p>The aim of this guide is to give some help to those who are competent in C but have not used it when writing for the RISC&nbsp;OS desktop. It will also introduce the use of SFLib, which may be of interest to those writing Wimp software using OSLib.</p>

<p>The style of coding has evolved a little over the decade or more that work on the project has been in progress. These day it tends to favour the C99 standard that RISC&nbsp;OS Open encourage with the DDE, but older examples often adhere to older styles of coding. I sometimes update older code when I come across it, but there are still many pre-C99 constructs in the application. Given that C99 is supported on RISC&nbsp;OS by both the DDE and GCC, I would recommend taking advantage of the facilities offered by the newer standard whenever possible.</p>

<p>Many thanks to all those on the <link href="https://www.riscosopen.org/forum/">ROOL Forums</link> who have answered my questions about the DDE and offered suggestions while I&rsquo;ve worked on this guide.</p>
</section>

<chapterlist/>

<section>
<title>About this tutorial</title>

<p>This tutorial is licenced under Version 1.2 of the European Union Public Licence, and the source &ndash; in the form of a collection of XML files and the associated graphics and example downloads &ndash; can be found <link href="https://github.com/steve-fryatt/wimp-tutorial">on GitHub</link>. It can be built into the format required by this website using my <link href="https://github.com/steve-fryatt/xmldocs">XML Docs tools</link>; these may be useful as a starting point for using the content in other forms, and are also released under the EUPL&nbsp;v1.2.</p>
</section>
</index>

<chapter file="ch01-start-basic.xml"/>
<chapter file="ch02-moving-to-c.xml"/>
<chapter file="ch03-compiling.xml"/>
<chapter file="ch04-event-driven.xml"/>
<chapter file="ch05-compile-better.xml"/>
<chapter file="ch06-ibar.xml"/>
<chapter file="ch07-click.xml"/>
<chapter file="ch08-report.xml"/>
<chapter file="ch09-debug.xml"/>
<chapter file="ch10-report2.xml"/>
<chapter file="ch11-windows.xml"/>
<chapter file="ch12-window-theory.xml"/>
<chapter file="ch13-window-handling.xml"/>
<chapter file="ch14-icons-intro.xml"/>
<chapter file="ch15-icons-indirect.xml"/>
<chapter file="ch16-interact-click.xml"/>
<chapter file="ch17-appdir.xml"/>
<chapter file="ch18-icons-sprite.xml"/>
<chapter file="ch19-templates.xml"/>
<chapter file="ch20-icons-radio.xml"/>
<chapter file="ch21-icons-sprite-area.xml"/>
<chapter file="ch22-menus-intro.xml"/>
<chapter file="ch23-menus-selection.xml"/>
<chapter file="ch24-menus-popup.xml"/>
<chapter file="ch25-menus-window.xml"/>
<chapter file="ch26-menus-revisited.xml"/>
<chapter file="ch27-icons-writable.xml"/>
<chapter file="ch28-key-input.xml"/>
<chapter file="ch29-message-trans.xml"/>
<chapter file="ch30-internationalisation.xml"/>
<chapter file="ch31-window-redraw-theory.xml"/>
<chapter file="ch32-window-redraw-content.xml"/>
<chapter file="ch33-window-redraw-cookbook.xml"/>
<chapter file="ch34-user-messages.xml"/>
<chapter file="ch35-interactive-help.xml"/>
</manual>
